{
  "schema_version":"2.0.0","record_type":"event_policy","policy_id":"policy-flood-region-4","event_id":"flood-response-region-4","version":"1.0.0","mission":"Provide current, scoped flood response guidance over disconnected SMS and LoRa links.",
  "deployment_scope":{"deployment_ids":["site-r4-north"],"geographies":["region-4/zone-north"],"languages":["en","es"],"audiences":["public"],"delivery_channels":["sms","lora"]},
  "authority_registry":[
    {"authority_id":"authority-r4-emergency","name":"Region 4 Emergency Office","authority_class":"official","publisher_ids":["publisher-r4-emergency"],"source_ids":["source-shelter-r4","source-evacuation-old","source-evacuation-correction"],"subjects":["shelter-status","evacuation-route"],"geographies":["region-4/zone-north"]},
    {"authority_id":"authority-r4-water","name":"Region 4 Water Utility","authority_class":"official","publisher_ids":["publisher-r4-water"],"source_ids":["source-water-r4"],"subjects":["water-safety"],"geographies":["region-4/zone-north"]},
    {"authority_id":"authority-r5-emergency","name":"Region 5 Emergency Office","authority_class":"official","publisher_ids":["publisher-r5-emergency"],"source_ids":["source-shelter-r5"],"subjects":["shelter-status"],"geographies":["region-5/zone-north"]}
  ],
  "coverage_requirements":[
    {"requirement_id":"coverage-shelter","safety_class":"critical","selector":{"required_fact_ids":["shelter-r4-status"],"required_document_ids":["doc-shelter-r4-en","doc-shelter-r4-es"]},"scope":{"languages":["en","es"],"geographies":["region-4/zone-north"],"audiences":["public"],"delivery_channels":["sms","lora"]},"minimum_approved_documents":2,"minimum_independent_sources":1,"allowed_authority_classes":["official"],"freshness":{"require_valid_at_activation":true,"maximum_age_seconds":7200,"stale_action":"block"},"evaluation_cases":{"minimum_positive":1,"minimum_boundary":1,"minimum_no_answer":1}},
    {"requirement_id":"coverage-water","safety_class":"critical","selector":{"required_fact_ids":["water-r4-boil"],"required_document_ids":["doc-water-r4-es"]},"scope":{"languages":["es"],"geographies":["region-4/zone-north"],"audiences":["public"],"delivery_channels":["sms","lora"]},"minimum_approved_documents":1,"minimum_independent_sources":1,"allowed_authority_classes":["official"],"freshness":{"require_valid_at_activation":true,"maximum_age_seconds":7200,"stale_action":"block"},"evaluation_cases":{"minimum_positive":1,"minimum_boundary":1,"minimum_no_answer":1}},
    {"requirement_id":"coverage-evacuation","safety_class":"critical","selector":{"required_fact_ids":["evacuation-r4-current"],"required_document_ids":["doc-evacuation-r4-current"]},"scope":{"languages":["en"],"geographies":["region-4/zone-north"],"audiences":["public"],"delivery_channels":["sms","lora"]},"minimum_approved_documents":1,"minimum_independent_sources":1,"allowed_authority_classes":["official"],"freshness":{"require_valid_at_activation":true,"maximum_age_seconds":7200,"stale_action":"block"},"evaluation_cases":{"minimum_positive":1,"minimum_boundary":1,"minimum_no_answer":1}}
  ],
  "no_answer_policy":{"response_action":"escalate","escalation_required":true,"escalation_route":"local-operations-desk","message_template":"Verified information is unavailable. Contact the local operations desk."},
  "human_approval_attestations":[
    {"attestation_id":"approval-drill-domain","reviewer_identity":"domain.reviewer@example.test","reviewer_role":"domain_sme","independence_group":"regional-safety-office","decision":"approve","policy_digest":"sha256:d65f2edc32490efca1f1c3d4384c05b653baf274470085b0c66593a7fd20fea7","approved_at":"2026-10-06T17:40:00Z"},
    {"attestation_id":"approval-drill-local","reviewer_identity":"local.reviewer@example.test","reviewer_role":"local_sme","independence_group":"community-review-council","decision":"approve","policy_digest":"sha256:d65f2edc32490efca1f1c3d4384c05b653baf274470085b0c66593a7fd20fea7","approved_at":"2026-10-06T17:45:00Z"}
  ]
}
